{
  "$schema": "../../schemas/script_config.schema.json",
  "onLoad": "SafariZoneGateOnLoad",
  "coordEvents": [
    {
      "name": "gateRow1",
      "position": [
        3,
        2
      ],
      "trigger": "gateRow"
    },
    {
      "name": "gateRow2",
      "position": [
        4,
        2
      ],
      "trigger": "gateRow"
    }
  ],
  "npcs": [
    {
      "id": 1,
      "talk": "talkSafariZoneWorker1"
    },
    {
      "id": 2,
      "talk": "talkSafariZoneWorker2"
    }
  ],
  "signs": []
}
