{
  "$schema": "../../schemas/script_config.schema.json",
  "coordEvents": [
    {
      "name": "lockEntrance",
      "position": [
        6,
        11
      ],
      "trigger": "lockEntrance"
    },
    {
      "name": "lockEntrance2",
      "position": [
        5,
        11
      ],
      "trigger": "lockEntrance"
    },
    {
      "name": "lanceStep1",
      "position": [
        5,
        1
      ],
      "trigger": "lanceStep"
    },
    {
      "name": "lanceStep2",
      "position": [
        6,
        2
      ],
      "trigger": "lanceStep"
    }
  ],
  "npcs": [
    {
      "id": 1,
      "talk": "talkLance"
    }
  ],
  "onLoad": "LancesRoomOnLoad",
  "signs": []
}
