{
  "$schema": "../../schemas/script_config.schema.json",
  "coordEvents": [
    {
      "name": "cardKeyDoor1",
      "position": [
        6,
        12
      ],
      "trigger": "cardKeyDoor"
    },
    {
      "name": "cardKeyDoor2",
      "position": [
        6,
        13
      ],
      "trigger": "cardKeyDoor"
    }
  ],
  "npcs": [
    {
      "id": 1,
      "talk": "talkSilphPresident"
    },
    {
      "id": 2,
      "talk": "talkBeauty"
    },
    {
      "id": 3,
      "talk": "talkGiovanni",
      "toggleId": "SILPH_CO_11F_OBJ_3"
    },
    {
      "id": 4,
      "talk": "talkRocket",
      "toggleId": "SILPH_CO_11F_OBJ_4"
    },
    {
      "id": 5,
      "talk": "talkRocket1",
      "toggleId": "SILPH_CO_11F_OBJ_5"
    }
  ],
  "signs": [
    {
      "id": 1,
      "talk": "pcSign1"
    }
  ],
  "onLoad": "SilphCo11FOnLoad"
}