{
  "$schema": "../../schemas/script_config.schema.json",
  "onLoad": "enterMap",
  "npcs": [
    {
      "id": 1,
      "talk": "talkNurse"
    },
    {
      "id": 2,
      "talk": "talkGentleman"
    },
    {
      "id": 3,
      "talk": "talkBeauty"
    },
    {
      "id": 4,
      "talk": "talkLinkReceptionist"
    }
  ],
  "signs": [
    {
      "id": 1,
      "talk": "pcStorage"
    }
  ],
  "coordEvents": []
}
